{
  "technologiesCount": 18,
  "bio": "IT professional focused on system administration, enterprise networking, and Security Operations Center (SOC) workflows. I manage Windows and Linux servers, troubleshoot network issues, analyze security alerts, and document incidents. I'm also learning JavaScript and Python at a beginner level to automate routine tasks and build practical tools for IT operations.",
  "name": "Arjun K S",
  "resume": "/images/uploads/arjunkailassadasivanpillairesume_2025.pdf",
  "tagline": "Securing infrastructure, monitoring threats, and building with code",
  "projectsCompleted": 12,
  "location": "Home : Kollam, Kerala | Working : Male, Maldives",
  "yearsOfExperience": 12,
  "title": "System Administrator | Network & Cybersecurity (SOC) | Aspiring Developer",
  "avatar": "/images/avatar.svg",
  "introTexts": [
    "System Administrator",
    "Network Administrator",
    "SOC Analyst L1",
    "Security Monitoring"
  ],
  "experienceSummary": "Hands-on experience in server management, network support, SOC alert triage, and foundational scripting with Python and JavaScript.",
  "email": "hello@stackbyarjun.com"
}
